GC_HIST_ID,GC_ID,GC_NM_OFF_EN,GC_NM_OFF_FR,GC_NM_AB_EN,GC_NM_AB_FR,STAT_CD,STAT_DESC_EN,STAT_DESC_FR,TYPE_CD,TYPE_DESC_EN,TYPE_DESC_FR,EFF_DT,EFF_FN_DT,OBSERVATIONS_EN,OBSERVATIONS_FR,GC_PAR_ID,GC_JUR_ID,ISO_ALPHA_2_CD,ISO_ALPHA_3_CD,UN_ONU_CD,MODIF_DT
1000110.0,10001.0,the Republic of Fiji,la République des Fidji,Fiji,Fidji,1.0,ACTIVE,ACTIF,1.0,Country,Pays,1970-01-01,2100-01-01,,,,,FJ,FJI,242.0,2023-11-28
1000210.0,10002.0,South Georgia and the South Sandwich Islands,Géorgie du Sud-et-les Îles Sandwich du Sud,South Georgia and the South Sandwich Islands,Géorgie du Sud-et-les Îles Sandwich du Sud,1.0,ACTIVE,ACTIF,2.0,Territory,Territoire,1993-01-01,2100-01-01,,,10183.0,10135.0,GS,SGS,239.0,2023-11-28
1000310.0,10003.0,the People’s Republic of China,la République populaire de Chine,China,Chine,1.0,ACTIVE,ACTIF,1.0,Country,Pays,1949-01-01,2100-01-01,,,,,CN,CHN,156.0,2023-11-28
1000410.0,10004.0,the Republic of Slovenia,la République de Slovénie,Slovenia,Slovénie,1.0,ACTIVE,ACTIF,1.0,Country,Pays,1991-01-01,2100-01-01,,,,,SI,SVN,705.0,2023-11-28
1000508.0,10005.0,Gilbert and Ellice Islands,les îles Gilbert et Ellice,Gilbert and Ellice Islands,îles Gilbert et Ellice,2.0,INACTIVE,INACTIF,2.0,Territory,Territoire,1900-01-01,1975-12-31,,,,,KI,KIR,296.0,2023-11-28
1000509.0,10005.0,Gilbert Islands,les îles Gilbert,Gilbert Islands,îles Gilbert,2.0,INACTIVE,INACTIF,2.0,Territory,Territoire,1976-01-01,1978-12-31,,,,,KI,KIR,296.0,2023-11-28
1000510.0,10005.0,the Republic of Kiribati,la République de Kiribati,Kiribati,Kiribati,1.0,ACTIVE,ACTIF,1.0,Country,Pays,1979-01-01,2100-01-01,,,,,KI,KIR,296.0,2023-11-28
1000610.0,10006.0,the French Republic,la République française,France,France,1.0,ACTIVE,ACTIF,1.0,Country,Pays,1900-01-01,2100-01-01,,,,,FR,FRA,250.0,2023-11-28
1000710.0,10007.0,the People’s Democratic Republic of Algeria,la République algérienne démocratique et populaire,Algeria,Algérie,1.0,ACTIVE,ACTIF,1.0,Country,Pays,1962-01-01,2100-01-01,,,,,DZ,DZA,12.0,2023-11-28
1000810.0,10008.0,the Republic of Seychelles,la République des Seychelles,Seychelles,Seychelles,1.0,ACTIVE,ACTIF,1.0,Country,Pays,1976-01-01,2100-01-01,,,,,SC,SYC,690.0,2023-11-28
1000910.0,10009.0,the State of Kuwait,l’État du Koweït,Kuwait,Koweït,1.0,ACTIVE,ACTIF,1.0,Country,Pays,1961-01-01,2100-01-01,,,,,KW,KWT,414.0,2023-11-28
1001010.0,10010.0,the Democratic People’s Republic of Korea,la République populaire démocratique de Corée,North Korea,Corée du Nord,1.0,ACTIVE,ACTIF,1.0,Country,Pays,1953-01-01,2100-01-01,The Democratic People’s Republic of Korea is the correct and official name to be used in all public correspondence. North Korea is informal and not officially recognized.,La République populaire démocratique de Corée est le nom correct et officiel à utiliser dans toute correspondance publique. La Corée du Nord est un nom informel qui n'est pas officiellement reconnu.,,,KP,PRK,408.0,2023-11-28
1001109.0,10011.0,the Republic of Georgia,la République de Géorgie,Georgia,Géorgie,2.0,INACTIVE,INACTIF,1.0,Country,Pays,1991-01-01,1994-12-31,,,,,GE,GEO,268.0,2023-11-28
1001110.0,10011.0,Georgia,Géorgie,Georgia,Géorgie,1.0,ACTIVE,ACTIF,1.0,Country,Pays,1995-01-01,2100-01-01,,,,,GE,GEO,268.0,2023-11-28
1001209.0,10012.0,the People’s Republic of Benin,la République populaire du Bénin,Benin,Bénin,2.0,INACTIVE,INACTIF,1.0,Country,Pays,1975-01-01,1989-12-31,,,,,BJ,BEN,204.0,2023-11-28
1001210.0,10012.0,the Republic of Benin,la République du Bénin,Benin,Bénin,1.0,ACTIVE,ACTIF,1.0,Country,Pays,1990-01-01,2100-01-01,,,,,BJ,BEN,204.0,2023-11-28
1001310.0,10013.0,Isle of Man,Île de Man,Isle of Man,Île de Man,1.0,ACTIVE,ACTIF,2.0,Territory,Territoire,1900-01-01,2100-01-01,,,,10135.0,IM,IMN,833.0,2023-11-28
1001409.0,10014.0,the Republic of Ivory Coast,la République de Côte d’Ivoire,Ivory Coast,Côte d’Ivoire,2.0,INACTIVE,INACTIF,1.0,Country,Pays,1960-01-01,1985-12-31,,,,,CI,CIV,384.0,2023-11-28
1001410.0,10014.0,the Republic of Côte d’Ivoire,la République de Côte d’Ivoire,Côte d’Ivoire,Côte d’Ivoire,1.0,ACTIVE,ACTIF,1.0,Country,Pays,1986-01-01,2100-01-01,,,,,CI,CIV,384.0,2023-11-28
1001510.0,10015.0,the Republic of Singapore,la République de Singapour,Singapore,Singapour,1.0,ACTIVE,ACTIF,1.0,Country,Pays,1965-01-01,2100-01-01,,,,,SG,SGP,702.0,2023-11-28
1001609.0,10016.0,"the Pitcairn, Henderson, Ducie, and Oeno Islands","Les Îles Pitcairn, Henderson, Ducie et Oeno",Pitcairn Islands,Îles Pitcairn,2.0,INACTIVE,INACTIF,6.0,Non-Self-Governing Territory,Territoire non autonome,1900-01-01,1981-12-31,,,,10135.0,PN,PCN,612.0,2023-11-28
1001610.0,10016.0,"the Pitcairn, Henderson, Ducie, and Oeno Islands","Les Îles Pitcairn, Henderson, Ducie et Oeno",Pitcairn,Pitcairn,1.0,ACTIVE,ACTIF,6.0,Non-Self-Governing Territory,Territoire non autonome,1982-01-01,2100-01-01,,,,10135.0,PN,PCN,612.0,2023-11-28
1001710.0,10017.0,the Kingdom of Denmark,le Royaume du Danemark,Denmark,Danemark,1.0,ACTIVE,ACTIF,1.0,Country,Pays,1900-01-01,2100-01-01,,,,,DK,DNK,208.0,2023-11-28
1001809.0,10018.0,British Honduras,Honduras britannique,British Honduras,Honduras britannique,2.0,INACTIVE,INACTIF,2.0,Territory,Territoire,1900-01-01,1980-12-31,,,,,BZ,BLZ,84.0,2025-09-21
1001810.0,10018.0,Belize,Belize,Belize,Belize,1.0,ACTIVE,ACTIF,1.0,Country,Pays,1981-01-01,2100-01-01,,,,,BZ,BLZ,84.0,2023-11-28
1001910.0,10019.0,Grenada,Grenade,Grenada,Grenade,1.0,ACTIVE,ACTIF,1.0,Country,Pays,1974-01-01,2100-01-01,,,,,GD,GRD,308.0,2023-11-28
1002010.0,10020.0,the Republic of Honduras,la République du Honduras,Honduras,Honduras,1.0,ACTIVE,ACTIF,1.0,Country,Pays,1900-01-01,2100-01-01,,,,,HN,HND,340.0,2023-11-28
1002110.0,10021.0,the Republic of Nicaragua,la République du Nicaragua,Nicaragua,Nicaragua,1.0,ACTIVE,ACTIF,1.0,Country,Pays,1900-01-01,2100-01-01,,,,,NI,NIC,558.0,2023-11-28
1002209.0,10022.0,East Timor,Timor oriental,East Timor,Timor oriental,2.0,INACTIVE,INACTIF,1.0,Country,Pays,1975-01-01,2001-12-31,,,,,TL,TLS,626.0,2024-05-15
1002210.0,10022.0,the Democratic Republic of Timor-Leste,la République démocratique du Timor-Leste,Timor-Leste,Timor-Leste,1.0,ACTIVE,ACTIF,1.0,Country,Pays,2002-01-01,2100-01-01,,,,,TL,TLS,626.0,2023-11-28
1002310.0,10023.0,the Republic of Mali,la République du Mali,Mali,Mali,1.0,ACTIVE,ACTIF,1.0,Country,Pays,1960-01-01,2100-01-01,,,,,ML,MLI,466.0,2023-11-28
1002410.0,10024.0,the Socialist Republic of Vietnam,la République socialiste du Vietnam,Vietnam,Vietnam,1.0,ACTIVE,ACTIF,1.0,Country,Pays,1976-01-01,2100-01-01,,,,,VN,VNM,704.0,2023-11-28
1002510.0,10025.0,the Federal Democratic Republic of Nepal,la République fédérale démocratique du Népal,Nepal,Népal,1.0,ACTIVE,ACTIF,1.0,Country,Pays,2008-01-01,2100-01-01,,,,,NP,NPL,524.0,2023-11-28
1002610.0,10026.0,Bosnia and Herzegovina,Bosnie-Herzégovine,Bosnia and Herzegovina,Bosnie-Herzégovine,1.0,ACTIVE,ACTIF,1.0,Country,Pays,1992-01-01,2100-01-01,,,,,BA,BIH,70.0,2023-11-28
1002709.0,10027.0,"Bonaire, Saint Eustatius and Saba","Bonaire, Saint-Eustache et Saba","Bonaire, Saint Eustatius and Saba","Bonaire, Saint-Eustache et Saba",2.0,INACTIVE,INACTIF,2.0,Territory,Territoire,2010-01-01,2010-12-31,,,,10098.0,BQ,BES,535.0,2023-11-28
1002710.0,10027.0,"Bonaire, Sint Eustatius and Saba","Bonaire, Saint-Eustache et Saba","Bonaire, Sint Eustatius and Saba","Bonaire, Saint-Eustache et Saba",1.0,ACTIVE,ACTIF,2.0,Territory,Territoire,2011-01-01,2100-01-01,,,,10098.0,BQ,BES,535.0,2023-11-28
1002810.0,10028.0,the Republic of Paraguay,la République du Paraguay,Paraguay,Paraguay,1.0,ACTIVE,ACTIF,1.0,Country,Pays,1900-01-01,2100-01-01,,,,,PY,PRY,600.0,2023-11-28
1002910.0,10029.0,the Republic of Rwanda,la République du Rwanda,Rwanda,Rwanda,1.0,ACTIVE,ACTIF,1.0,Country,Pays,1962-01-01,2100-01-01,,,,,RW,RWA,646.0,2023-11-28
1003010.0,10030.0,Guadeloupe,Guadeloupe,Guadeloupe,Guadeloupe,1.0,ACTIVE,ACTIF,2.0,Territory,Territoire,1900-01-01,2100-01-01,,,,10006.0,GP,GLP,312.0,2023-11-28
1003109.0,10031.0,the Independent State of Western Samoa,l’État indépendant des Samoas occidentales,Western Samoa,Samoa occidentales,2.0,INACTIVE,INACTIF,1.0,Country,Pays,1962-01-01,1996-12-31,,,,,WS,WSM,882.0,2023-11-28
1003110.0,10031.0,the Independent State of Samoa,l’État indépendant du Samoa,Samoa,Samoa,1.0,ACTIVE,ACTIF,1.0,Country,Pays,1997-01-01,2100-01-01,,,,,WS,WSM,882.0,2023-11-28
1003210.0,10032.0,French Southern and Antarctic Territories,Terres australes et antarctiques françaises,French Southern and Antarctic Territories,Terres australes et antarctiques françaises,1.0,ACTIVE,ACTIF,2.0,Territory,Territoire,1955-01-01,2100-01-01,,,,10006.0,TF,ATF,260.0,2023-11-28
1003310.0,10033.0,the Republic of Chad,la République du Tchad,Chad,Tchad,1.0,ACTIVE,ACTIF,1.0,Country,Pays,1960-01-01,2100-01-01,,,,,TD,TCD,148.0,2023-11-28
1003410.0,10034.0,the Republic of Malawi,la République du Malawi,Malawi,Malawi,1.0,ACTIVE,ACTIF,1.0,Country,Pays,1966-01-01,2100-01-01,,,,,MW,MWI,454.0,2023-11-28
1003510.0,10035.0,the Russian Federation,la Fédération de Russie,Russia,Russie,1.0,ACTIVE,ACTIF,1.0,Country,Pays,1991-01-01,2100-01-01,,,,,RU,RUS,643.0,2023-11-28
1003608.0,10036.0,Republic of the Sudan,République du Soudan,Sudan,Soudan,2.0,INACTIVE,INACTIF,1.0,Country,Pays,1956-01-01,1968-12-31,,,,,SD,SDN,729.0,2023-11-28
1003609.0,10036.0,Democratic Republic of Sudan,la République démocratique du Soudan,Sudan,Soudan,2.0,INACTIVE,INACTIF,1.0,Country,Pays,1969-01-01,1984-12-31,,,,,SD,SDN,729.0,2023-11-28
1003610.0,10036.0,the Republic of the Sudan,la République du Soudan,Sudan,Soudan,1.0,ACTIVE,ACTIF,1.0,Country,Pays,1985-01-01,2100-01-01,,,,,SD,SDN,729.0,2023-11-28
1003709.0,10037.0,Saint Vincent,Saint-Vincent,Saint Vincent,Saint-Vincent,2.0,INACTIVE,INACTIF,2.0,Territory,Territoire,1900-01-01,1978-12-31,,,,,VC,VCT,670.0,2023-11-28
1003710.0,10037.0,Saint Vincent and the Grenadines,Saint-Vincent-et-les Grenadines,Saint Vincent and the Grenadines,Saint-Vincent-et-les Grenadines,1.0,ACTIVE,ACTIF,1.0,Country,Pays,1979-01-01,2100-01-01,,,,,VC,VCT,670.0,2023-11-28
1003807.0,10038.0,French West Africa,Afrique-Occidentale française,Upper Volta,Haute-Volta,2.0,INACTIVE,INACTIF,2.0,Territory,Territoire,1900-01-01,1957-12-31,,,,,BF,BFA,854.0,2023-11-28
1003808.0,10038.0,the Republic of Upper Volta,la République de Haute-Volta,Upper Volta,Haute-Volta,2.0,INACTIVE,INACTIF,1.0,Country,Pays,1958-01-01,1983-12-31,,,,,BF,BFA,854.0,2023-11-28
1003809.0,10038.0,the Republic of Burkina Faso,la République du Burkina Faso,Burkina,Burkina,2.0,INACTIVE,INACTIF,1.0,Country,Pays,1984-01-01,1998-12-31,,,,,BF,BFA,854.0,2023-11-28
1003810.0,10038.0,Burkina Faso,Burkina Faso,Burkina Faso,Burkina Faso,1.0,ACTIVE,ACTIF,1.0,Country,Pays,1999-01-01,2100-01-01,,,,,BF,BFA,854.0,2023-11-28
1003910.0,10039.0,the Togolese Republic,la République togolaise,Togo,Togo,1.0,ACTIVE,ACTIF,1.0,Country,Pays,1960-01-01,2100-01-01,,,,,TG,TGO,768.0,2023-11-28
1004010.0,10040.0,the Republic of Zambia,la République de Zambie,Zambia,Zambie,1.0,ACTIVE,ACTIF,1.0,Country,Pays,1964-01-01,2100-01-01,,,,,ZM,ZMB,894.0,2023-11-28
1004210.0,10042.0,Svalbard and Jan Mayen Islands,Îles Svalbard-et-Jan Mayen,Svalbard and Jan Mayen Islands,Îles Svalbard-et-Jan Mayen,1.0,ACTIVE,ACTIF,2.0,Territory,Territoire,1925-01-01,2100-01-01,,,,10246.0,SJ,SJM,744.0,2023-11-28
1004308.0,10043.0,Hungarian People’s Republic,République populaire de Hongrie,Hungary,Hongrie,2.0,INACTIVE,INACTIF,1.0,Country,Pays,1949-01-01,1988-12-31,,,,,HU,HUN,348.0,2023-11-28
1004309.0,10043.0,Republic of Hungary,République de Hongrie,Hungary,Hongrie,2.0,INACTIVE,INACTIF,1.0,Country,Pays,1989-01-01,2011-12-31,,,,,HU,HUN,348.0,2023-11-28
1004310.0,10043.0,Hungary,Hongrie,Hungary,Hongrie,1.0,ACTIVE,ACTIF,1.0,Country,Pays,2012-01-01,2100-01-01,,,,,HU,HUN,348.0,2023-11-28
1004408.0,10044.0,Cape Verde Islands,Îles du Cap-Vert,Cape Verde,Cap-Vert,2.0,INACTIVE,INACTIF,1.0,Country,Pays,1900-01-01,1974-12-31,,,,,CV,CPV,132.0,2023-11-28
1004409.0,10044.0,Cape Verde,Cap-Vert,Cape Verde,Cap-Vert,2.0,INACTIVE,INACTIF,1.0,Country,Pays,1975-01-01,2013-12-31,,,,,CV,CPV,132.0,2023-11-28
1004410.0,10044.0,the Republic of Cabo Verde,la République de Cabo Verde,Cabo Verde,Cabo Verde,1.0,ACTIVE,ACTIF,1.0,Country,Pays,2014-01-01,2100-01-01,,,,,CV,CPV,132.0,2023-11-28
1004510.0,10045.0,Curaçao,Curaçao,Curaçao,Curaçao,1.0,ACTIVE,ACTIF,2.0,Territory,Territoire,2010-01-01,2100-01-01,,,,10098.0,CW,CUW,531.0,2023-11-28
1004610.0,10046.0,British Indian Ocean Territory,Territoire britannique de l’océan Indien,British Indian Ocean Territory,Territoire britannique de l’océan Indien,1.0,ACTIVE,ACTIF,2.0,Territory,Territoire,1965-01-01,2100-01-01,,,10008.0,10135.0,IO,IOT,86.0,2023-11-28
1004710.0,10047.0,the Republic of Uganda,la République de l’Ouganda,Uganda,Ouganda,1.0,ACTIVE,ACTIF,1.0,Country,Pays,1963-01-01,2100-01-01,,,,,UG,UGA,800.0,2023-11-28
1004810.0,10048.0,the Republic of Ghana,la République du Ghana,Ghana,Ghana,1.0,ACTIVE,ACTIF,1.0,Country,Pays,1957-01-01,2100-01-01,,,,,GH,GHA,288.0,2023-11-28
1004910.0,10049.0,Panama Canal Zone,"Panama, Zone du Canal de",Panama Canal Zone,"Panama, Zone du Canal de",2.0,INACTIVE,INACTIF,2.0,Territory,Territoire,1903-01-01,1978-12-31,,,,,,,,2023-11-28
1005110.0,10051.0,the Republic of Colombia,la République de Colombie,Colombia,Colombie,1.0,ACTIVE,ACTIF,1.0,Country,Pays,1900-01-01,2100-01-01,,,,,CO,COL,170.0,2023-11-28
1005210.0,10052.0,the Republic of Tunisia,la République tunisienne,Tunisia,Tunisie,1.0,ACTIVE,ACTIF,1.0,Country,Pays,1956-01-01,2100-01-01,,,,,TN,TUN,788.0,2023-11-28
1005310.0,10053.0,the Kingdom of Bhutan,le Royaume du Bhoutan,Bhutan,Bhoutan,1.0,ACTIVE,ACTIF,1.0,Country,Pays,1949-01-01,2100-01-01,,,,,BT,BTN,64.0,2023-11-28
1005409.0,10054.0,the Hashemite Kingdom of Transjordan,le Royaume hachémite de Transjordanie,Transjordan,Transjordanie,2.0,INACTIVE,INACTIF,1.0,Country,Pays,1946-01-01,1948-12-31,,,,,JO,JOR,400.0,2023-11-28
1005410.0,10054.0,the Hashemite Kingdom of Jordan,le Royaume hachémite de Jordanie,Jordan,Jordanie,1.0,ACTIVE,ACTIF,1.0,Country,Pays,1949-01-01,2100-01-01,,,,,JO,JOR,400.0,2023-11-28
1005510.0,10055.0,the Republic of Yemen,la République du Yémen,Yemen,Yémen,1.0,ACTIVE,ACTIF,1.0,Country,Pays,1990-01-01,2100-01-01,,,,,YE,YEM,887.0,2023-11-28
1005610.0,10056.0,the Republic of Madagascar,la République de Madagascar,Madagascar,Madagascar,1.0,ACTIVE,ACTIF,1.0,Country,Pays,1960-01-01,2100-01-01,,,,,MG,MDG,450.0,2023-11-28
1005710.0,10057.0,German Democratic Republic,République démocratique allemande,German Democratic Republic,République démocratique allemande,2.0,INACTIVE,INACTIF,1.0,Country,Pays,1945-01-01,1989-12-31,,,,,,,,2023-11-28
1005809.0,10058.0,the Cook Islands,les îles Cook,Cook Islands,Cook (les Îles),2.0,INACTIVE,INACTIF,2.0,Territory,Territoire,1900-01-01,2023-12-11,,,,,CK,COK,184.0,2024-05-15
1005810.0,10058.0,the Cook Islands,les îles Cook,Cook Islands,Îles Cook,1.0,ACTIVE,ACTIF,5.0,Special Cases,Cas spéciaux,2023-12-12,2100-01-01,,,,,CK,COK,184.0,2023-11-28
1005910.0,10059.0,Barbados,Barbade,Barbados,Barbade,1.0,ACTIVE,ACTIF,1.0,Country,Pays,1966-01-01,2100-01-01,,,,,BB,BRB,52.0,2023-11-28
1006010.0,10060.0,British Virgin Islands,Vierges britanniques (les Îles),British Virgin Islands,Vierges britanniques (les Îles),1.0,ACTIVE,ACTIF,6.0,Non-Self-Governing Territory,Territoire non autonome,1967-01-01,2100-01-01,,,,10135.0,VG,VGB,92.0,2023-11-28
1006109.0,10061.0,Federation of Malaya,Fédération de Malaisie,Malaya,Malaisie,2.0,INACTIVE,INACTIF,2.0,Territory,Territoire,1948-01-01,1956-12-31,,,,,MY,MYS,458.0,2023-11-28
1006110.0,10061.0,Malaysia,Malaisie,Malaysia,Malaisie,1.0,ACTIVE,ACTIF,1.0,Country,Pays,1957-01-01,2100-01-01,,,,,MY,MYS,458.0,2023-11-28
1006210.0,10062.0,the Commonwealth of Dominica,le Commonwealth de la Dominique,Dominica,Dominique,1.0,ACTIVE,ACTIF,1.0,Country,Pays,1978-01-01,2100-01-01,,,,,DM,DMA,212.0,2023-11-28
1006305.0,10063.0,the Kingdom of Cambodia,le Royaume du Cambodge,Cambodia,Cambodge,2.0,INACTIVE,INACTIF,1.0,Country,Pays,1953-01-01,1969-12-31,,,,,KH,KHM,116.0,2023-11-28
1006306.0,10063.0,Khmer Republic,République Khmère,Cambodia,Cambodge,2.0,INACTIVE,INACTIF,1.0,Country,Pays,1970-01-01,1974-12-31,,,,,KH,KHM,116.0,2023-11-28
1006307.0,10063.0,Democratic Kampuchea,Kampuchéa démocratique,Cambodia,Cambodge,2.0,INACTIVE,INACTIF,1.0,Country,Pays,1975-01-01,1978-12-31,,,,,KH,KHM,116.0,2023-11-28
1006308.0,10063.0,the People’s Republic of Kampuchea,République populaire du Kampuchéa,Cambodia,Cambodge,2.0,INACTIVE,INACTIF,1.0,Country,Pays,1979-01-01,1988-12-31,,,,,KH,KHM,116.0,2023-11-28
1006309.0,10063.0,State of Cambodia,Etat du Cambodge,Cambodia,Cambodge,2.0,INACTIVE,INACTIF,1.0,Country,Pays,1989-01-01,1992-12-31,,,,,KH,KHM,116.0,2023-11-28
1006310.0,10063.0,the Kingdom of Cambodia,le Royaume du Cambodge,Cambodia,Cambodge,1.0,ACTIVE,ACTIF,1.0,Country,Pays,1993-01-01,2100-01-01,,,,,KH,KHM,116.0,2023-11-28
1006409.0,10064.0,Mongolian People’s Republic,République populaire mongole,Mongolia,Mongolie,2.0,INACTIVE,INACTIF,1.0,Country,Pays,1924-01-01,1991-12-31,,,,,MN,MNG,496.0,2023-11-28
1006410.0,10064.0,Mongolia,Mongolie,Mongolia,Mongolie,1.0,ACTIVE,ACTIF,1.0,Country,Pays,1992-01-01,2100-01-01,,,,,MN,MNG,496.0,2023-11-28
1006510.0,10065.0,the Commonwealth of the Northern Mariana Islands,Le Commonwealth des Îles Mariannes du Nord,Northern Mariana Islands,Mariannes du Nord (les Îles),1.0,ACTIVE,ACTIF,2.0,Territory,Territoire,1986-01-01,2100-01-01,,,,10194.0,MP,MNP,580.0,2023-11-28
1006610.0,10066.0,the Principality of Andorra,la Principauté d’Andorre,Andorra,Andorre,1.0,ACTIVE,ACTIF,1.0,Country,Pays,1900-01-01,2100-01-01,,,,,AD,AND,20.0,2023-11-28
1006710.0,10067.0,the Federated States of Micronesia,les États fédérés de Micronésie,Micronesia,Micronésie,1.0,ACTIVE,ACTIF,1.0,Country,Pays,1986-01-01,2100-01-01,,,,,FM,FSM,583.0,2023-11-28
1006810.0,10068.0,the Territory of Norfolk Island,le territoire de l’Île Norfolk,Norfolk Island,Norfolk (l’Île),1.0,ACTIVE,ACTIF,2.0,Territory,Territoire,1900-01-01,2100-01-01,,,,10274.0,NF,NFK,574.0,2023-11-28
1006910.0,10069.0,Gibraltar,Gibraltar,Gibraltar,Gibraltar,1.0,ACTIVE,ACTIF,6.0,Non-Self-Governing Territory,Territoire non autonome,1900-01-01,2100-01-01,,,,10135.0,GI,GIB,292.0,2023-11-28
1007009.0,10070.0,Hong Kong,Hong Kong,Hong Kong,Hong Kong,2.0,INACTIVE,INACTIF,2.0,Territory,Territoire,1900-01-01,1996-12-31,,,,10003.0,HK,HKG,344.0,2023-11-28
1007010.0,10070.0,Hong Kong Special Administrative Region of the People’s Republic of China,la région administrative spéciale de Hong Kong de la République populaire de Chine,Hong Kong,Hong Kong,1.0,ACTIVE,ACTIF,2.0,Territory,Territoire,1997-01-01,2100-01-01,,,,10003.0,HK,HKG,344.0,2023-11-28
1007110.0,10071.0,Midway Islands,Îles Midway,Midway Islands,Îles Midway,2.0,INACTIVE,INACTIF,2.0,Territory,Territoire,1900-01-01,1985-12-31,,,,,,,,2023-11-28
1007210.0,10072.0,the Republic of Chile,la République du Chili,Chile,Chili,1.0,ACTIVE,ACTIF,1.0,Country,Pays,1900-01-01,2100-01-01,,,,,CL,CHL,152.0,2023-11-28
1007309.0,10073.0,Ethiopia,Éthiopie,Ethiopia,Éthiopie,2.0,INACTIVE,INACTIF,1.0,Country,Pays,1900-01-01,1994-12-31,,,,,ET,ETH,231.0,2025-09-21
1007310.0,10073.0,the Federal Democratic Republic of Ethiopia,la République fédérale démocratique d’Éthiopie,Ethiopia,Éthiopie,1.0,ACTIVE,ACTIF,1.0,Country,Pays,1995-01-01,2100-01-01,,,,,ET,ETH,231.0,2023-11-28
1007410.0,10074.0,the Swiss Confederation,la Confédération suisse,Switzerland,Suisse,1.0,ACTIVE,ACTIF,1.0,Country,Pays,1900-01-01,2100-01-01,,,,,CH,CHE,756.0,2023-11-28
1007510.0,10075.0,the State of Eritrea,l’État d’Érythrée,Eritrea,Érythrée,1.0,ACTIVE,ACTIF,1.0,Country,Pays,1993-01-01,2100-01-01,,,10073.0,,ER,ERI,232.0,2023-11-28
1007610.0,10076.0,the State of Qatar,l’État du Qatar,Qatar,Qatar,1.0,ACTIVE,ACTIF,1.0,Country,Pays,1971-01-01,2100-01-01,,,,,QA,QAT,634.0,2023-11-28
1007709.0,10077.0,the Republic of Bolivia,la République de Bolivie,Bolivia,Bolivie,2.0,INACTIVE,INACTIF,1.0,Country,Pays,1900-01-01,2008-12-31,,,,,BO,BOL,68.0,2025-09-21
1007710.0,10077.0,the Plurinational State of Bolivia,l’État plurinational de Bolivie,Bolivia,Bolivie,1.0,ACTIVE,ACTIF,1.0,Country,Pays,2009-01-01,2100-01-01,,,,,BO,BOL,68.0,2023-11-28
1008009.0,10080.0,the Netherlands East Indies,les Indes orientales néerlandaises,Dutch East Indies,Indes néerlandaises,2.0,INACTIVE,INACTIF,1.0,Country,Pays,1900-01-01,1948-12-31,,,,,ID,IDN,360.0,2025-09-21
1008010.0,10080.0,the Republic of Indonesia,la République d’Indonésie,Indonesia,Indonésie,1.0,ACTIVE,ACTIF,1.0,Country,Pays,1949-01-01,2100-01-01,,,,,ID,IDN,360.0,2023-11-28
1008110.0,10081.0,the Republic of Niger,la République du Niger,Niger,Niger,1.0,ACTIVE,ACTIF,1.0,Country,Pays,1960-01-01,2100-01-01,,,,,NE,NER,562.0,2023-11-28
1008210.0,10082.0,Bermuda,Bermudes (les),Bermuda,Bermudes (les),1.0,ACTIVE,ACTIF,6.0,Non-Self-Governing Territory,Territoire non autonome,1900-01-01,2100-01-01,,,,10135.0,BM,BMU,60.0,2023-11-28
1008310.0,10083.0,The Territory of Cocos (Keeling) Islands,Le territoire des Îles Cocos (Keeling),Cocos (Keeling) Islands,Cocos (les Îles)/ Keeling (les Îles),1.0,ACTIVE,ACTIF,2.0,Territory,Territoire,1955-01-01,2100-01-01,,,,10274.0,CC,CCK,166.0,2023-11-28
1008410.0,10084.0,the Republic of Trinidad and Tobago,la République de Trinité-et-Tobago,Trinidad and Tobago,Trinité-et-Tobago,1.0,ACTIVE,ACTIF,1.0,Country,Pays,1962-01-01,2100-01-01,,,,,TT,TTO,780.0,2023-11-28
1008509.0,10085.0,Belarus,Bélarus (le),Belarus,Bélarus (le),2.0,INACTIVE,INACTIF,1.0,Country,Pays,1918-01-01,1990-12-31,,,,,BY,BLR,112.0,2023-11-28
1008510.0,10085.0,the Republic of Belarus,la République du Bélarus,Belarus,Bélarus,1.0,ACTIVE,ACTIF,1.0,Country,Pays,1991-01-01,2100-01-01,,,,,BY,BLR,112.0,2023-11-28
1008610.0,10086.0,Collectivity of Saint Martin,Collectivité de Saint-Martin,Saint Martin (French Republic),Saint-Martin (République française),1.0,ACTIVE,ACTIF,2.0,Territory,Territoire,2007-01-01,2100-01-01,,,,10006.0,MF,MAF,663.0,2023-12-20
1008710.0,10087.0,the Portuguese Republic,la République portugaise,Portugal,Portugal,1.0,ACTIVE,ACTIF,1.0,Country,Pays,1910-01-01,2100-01-01,,,,,PT,PRT,620.0,2023-11-28
1008808.0,10088.0,the Republic of Cameroon,la République du Cameroun,Cameroon,Cameroun,2.0,INACTIVE,INACTIF,1.0,Country,Pays,1960-01-01,1971-12-31,,,,,CM,CMR,120.0,2025-09-21
1008809.0,10088.0,United Republic of Cameroon,Cameroun,Cameroon,Cameroun,2.0,INACTIVE,INACTIF,1.0,Country,Pays,1972-01-01,1983-12-31,,,,,CM,CMR,120.0,2023-11-28
1008810.0,10088.0,the Republic of Cameroon,la République du Cameroun,Cameroon,Cameroun,1.0,ACTIVE,ACTIF,1.0,Country,Pays,1984-01-01,2100-01-01,,,,,CM,CMR,120.0,2023-11-28
1008909.0,10089.0,Kingdom of Italy,Royaume d’Italie,Italy,Italie,2.0,INACTIVE,INACTIF,1.0,Country,Pays,1900-01-01,1947-12-31,,,,,IT,ITA,380.0,2025-09-21
1008910.0,10089.0,the Italian Republic,la République italienne,Italy,Italie,1.0,ACTIVE,ACTIF,1.0,Country,Pays,1948-01-01,2100-01-01,,,,,IT,ITA,380.0,2023-11-28
1009009.0,10090.0,British Solomon Islands,Îles Salomon britanniques,Solomon Islands,Îles Salomon,2.0,INACTIVE,INACTIF,2.0,Territory,Territoire,1900-01-01,1977-12-31,,,,,SB,SLB,90.0,2025-09-21
1009010.0,10090.0,the Solomon Islands,les Îles Salomon,Solomon Islands,Îles Salomon,1.0,ACTIVE,ACTIF,1.0,Country,Pays,1978-01-01,2100-01-01,,,,,SB,SLB,90.0,2023-11-28
1009110.0,10091.0,the Republic of El Salvador,la République d’El Salvador,El Salvador,Salvador,1.0,ACTIVE,ACTIF,1.0,Country,Pays,1900-01-01,2100-01-01,,,,,SV,SLV,222.0,2023-11-28
1009210.0,10092.0,the Republic of Botswana,la République du Botswana,Botswana,Botswana,1.0,ACTIVE,ACTIF,1.0,Country,Pays,1966-01-01,2100-01-01,,,,,BW,BWA,72.0,2023-11-28
1009310.0,10093.0,the Republic of Namibia,la République de Namibie,Namibia,Namibie,1.0,ACTIVE,ACTIF,1.0,Country,Pays,1990-01-01,2100-01-01,,,,,,NAM,516.0,2023-11-28
1009410.0,10094.0,the Central African Republic,la République centrafricaine,Central African Republic,République centrafricaine,1.0,ACTIVE,ACTIF,1.0,Country,Pays,1960-01-01,2100-01-01,,,,,CF,CAF,140.0,2023-11-28
1009510.0,10095.0,Czechoslovakia,Tchécoslovaquie,Czechoslovakia,Tchécoslovaquie,2.0,INACTIVE,INACTIF,1.0,Country,Pays,1918-01-01,1992-12-31,,,,,,,,2023-11-28
1009610.0,10096.0,the Republic of Turkmenistan,la République du Turkménistan,Turkmenistan,Turkménistan,1.0,ACTIVE,ACTIF,1.0,Country,Pays,1991-01-01,2100-01-01,,,,,TM,TKM,795.0,2023-11-28
1009710.0,10097.0,the Argentine Republic,la République argentine,Argentina,Argentine,1.0,ACTIVE,ACTIF,1.0,Country,Pays,1900-01-01,2100-01-01,,,,,AR,ARG,32.0,2023-11-28
1009810.0,10098.0,the Kingdom of the Netherlands,le Royaume des Pays-Bas,Netherlands,Pays-Bas,1.0,ACTIVE,ACTIF,1.0,Country,Pays,1900-01-01,2100-01-01,,,,,NL,NLD,528.0,2023-11-28
1009910.0,10099.0,the Republic of Maldives,la République des Maldives,Maldives,Maldives,1.0,ACTIVE,ACTIF,1.0,Country,Pays,1965-01-01,2100-01-01,,,,,MV,MDV,462.0,2023-11-28
1010009.0,10100.0,the Kindom of Swaziland,le Royaume du Swaziland,Swaziland,Swaziland,2.0,INACTIVE,INACTIF,1.0,Country,Pays,1903-01-01,1967-12-31,,,,,SZ,SWZ,748.0,2023-11-28
1010010.0,10100.0,the Kingdom of Eswatini,le Royaume d’Eswatini,Eswatini,Eswatini,1.0,ACTIVE,ACTIF,1.0,Country,Pays,1968-01-01,2100-01-01,,,,,SZ,SWZ,748.0,2023-11-28
1010108.0,10101.0,Myanmar,Myanmar (le),Myanmar,Myanmar (le),2.0,INACTIVE,INACTIF,1.0,Country,Pays,1989-01-01,2009-12-31,,,,,MM,MMR,104.0,2023-11-28
1010109.0,10101.0,Burma (Myanmar),Burma (Myanmar),Burma,Birmanie,2.0,INACTIVE,INACTIF,1.0,Country,Pays,2010-01-01,2018-12-31,,,,,MM,MMR,104.0,2023-11-28
1010110.0,10101.0,the Republic of the Union of Myanmar,la République de l’Union du Myanmar,Myanmar,Myanmar,1.0,ACTIVE,ACTIF,1.0,Country,Pays,2019-01-01,2100-01-01,,,,,MM,MMR,104.0,2023-11-28
